{
  "$schema": "https://json-schema.org/draft/2020-12/schema",
  "title": "AltmanAI Impact Record",
  "type": "object",
  "required": [
    "id",
    "title",
    "timestamp_utc",
    "summary",
    "people",
    "artifacts",
    "metrics",
    "risk_review",
    "tags"
  ],
  "properties": {
    "id": {
      "type": "string",
      "pattern": "^AFG-PAIHI-[0-9]{4}-[0-9]{2}-[0-9]{2}-[A-Z0-9-]+$"
    },
    "title": {
      "type": "string",
      "minLength": 3
    },
    "timestamp_utc": {
      "type": "string",
      "format": "date-time"
    },
    "summary": {
      "type": "string",
      "minLength": 10
    },
    "people": {
      "type": "array",
      "items": {
        "type": "object",
        "required": [
          "name",
          "role"
        ],
        "properties": {
          "name": {
            "type": "string"
          },
          "role": {
            "type": "string"
          }
        },
        "additionalProperties": false
      },
      "minItems": 1
    },
    "artifacts": {
      "type": "array",
      "items": {
        "type": "object",
        "required": [
          "path",
          "sha256",
          "type",
          "description"
        ],
        "properties": {
          "path": {
            "type": "string"
          },
          "sha256": {
            "type": "string",
            "pattern": "^[a-f0-9]{64}$"
          },
          "type": {
            "type": "string",
            "enum": [
              "doc",
              "code",
              "data",
              "image",
              "other"
            ]
          },
          "description": {
            "type": "string"
          }
        },
        "additionalProperties": false
      }
    },
    "metrics": {
      "type": "object",
      "additionalProperties": true
    },
    "risk_review": {
      "type": "object",
      "required": [
        "human_dignity",
        "privacy",
        "security",
        "notes"
      ],
      "properties": {
        "human_dignity": {
          "type": "string",
          "enum": [
            "PASS",
            "CONCERNS",
            "FAIL"
          ]
        },
        "privacy": {
          "type": "string",
          "enum": [
            "PASS",
            "CONCERNS",
            "FAIL"
          ]
        },
        "security": {
          "type": "string",
          "enum": [
            "PASS",
            "CONCERNS",
            "FAIL"
          ]
        },
        "notes": {
          "type": "string"
        }
      },
      "additionalProperties": false
    },
    "tags": {
      "type": "array",
      "items": {
        "type": "string"
      },
      "minItems": 1
    }
  },
  "additionalProperties": false
}